date, user_name, likes, comment 
2021.09.17, Linda琳, 390, 我的爷爷跟这位爷爷一样的病，现在庆幸我们全家没有那么自私的挽留爷爷。虽然那种失去亲人的痛是刻骨的，可是，我还是庆幸没有让我亲爱的爷爷没有遭这样的罪，您长眠，我长念，我爱您爷爷 
2021.09.17, 果然, 133, 怎么理解生命，对待生命，有尊严的活，是需要学习的。 
2021.09.17, 华华, 121, 谢谢您和我想法一样！icu让我父亲插管，我家都不同意，老公问我为什么，我说古代只有仇恨到极点才让人求生不得求死不能！我接我父亲回家了，被医生诊断一个月生命期的父亲现在挺过半年多了，无创呼吸机缓解病情 
2021.09.17, 枫海昕辰, 104, 这个视频真的很好很好。 
2021.09.17, 坚强的石头, 80, 如果有一天我这样了，希望家属家属让我安安静静的走， 
2021.09.17, 阿仔, 51, 我的母亲就是这个过程，我很认真的看视频，让我回忆起我的抉择，我的母亲就是这样给我抉择痛苦走的，妈妈，我对不起你，到现在看所有这些ICU的视频，我的痛苦流泪。救与不救至今同样无法抉择，都无法放过自己。 
2021.09.17, 夭夭, 64, 这是生不如死的痛苦儿女为了所谓的面子让老人受苦苦 
2021.09.17, 派大星、, 60, 很用心的视频，谢谢 
2021.09.17, 风铃, 53, 经历过所以理解医生更理解家属 
2021.09.17, 抓抓的女王, 32, 我认为还是要尊重个人意愿。提前和身边人说好交待好。这样家人心里也不会那么沉重。 
2021.09.17, 墨染年华ら, 35, 生与死，看到这些心里会隐隐作痛 
2021.09.17, 萍萍, 28, 感情上家属们是万般不舍，但是对于老人来说，一年零四个月，那是生不如死的折磨。我婆婆就是到最后插气管，医生说只是让她醒过来看看家人而已，最终还是要走的，但是我们选择了让她在昏迷中安静舒服的走。 
2021.09.17, 江江, 27, 哎，真的没有意义，所有人都痛苦 
2021.09.17, 暴躁君请歇歇, 23, 不知道说什么好，老人太痛苦了 
2021.09.20, 小盐小糖, 20, 每个人都是哭着来到这个世界，希望走的那一刻，可以笑着离开。琼瑶曾说：帮助我没有痛苦地离开，比千方百计让我痛苦地活着，意义更大。 
2022.02.08, 一路向北, 2, 是和六爷拍视频的老王吗 
2022.01.26, 俗人一族, 2, 这不是他 
2022.03.04, 美你屋美容馆, 0, 这不像老王 
2022.02.22, 66, 0, 想到了我的父亲，也是这样在ICU里面住了10多天后走了，心如刀绞 
2022.02.17, 容我爱你 深不见底 , 0, 其实这也是两难的选择，放弃治疗一个是不甘心，再一个就是会觉得自己不孝，不放弃治疗老人还遭罪，太难选择了，等我有那一天，我提前跟孩子说，不用考虑，直接放弃！ 
2022.02.16, 二, 0, 一路走好 
2022.02.09, 暖心（拒私聊）, 0, 好可惜 
2022.02.08, 陌生人, 0, 我默默的看完了，似乎想说什么但是又不知道说什么。我闭上眼睛叹了一口气。无奈的滑到下一个视频 
2022.02.07, @仙居饼佬工业路总店, 0, 我爸就是这样走的 
2022.01.27, 浅笑柔, 0, 如果有一天我病了决不受这样的醉 
2022.01.26, ！, 0, 我一个叔公也切气管已经维持一年了，确实生命只有一次但是活着我们都看得见 
2022.01.25, 不知道是谁的谁, 0, 感谢你记录了老王的最后一程 
2022.01.25, 岁月静好, 0, 看到这个视频，心如刀绞，我妈妈也是，一个人在Icu里苦苦的孤独的撑过了三十多天，终究去了天堂，看似孝顺的我们，其实对她是一种很残忍的折磨，哎！故事没看完，心真的一阵一阵的痛 
2022.01.25, 顺顺顺, 0, 老王一路走好 
2022.01.22, 回忆, 0, 唉，我婆婆那天也被医生插管走了 
2022.01.20, 郑, 0, 感动 
2022.01.19, aaaaa, 0, 有钱去帮有需要的人可以吗 
2022.01.19, 珍惜, 0, @ 
2022.01.17, 谢谢你的爱……, 0, 王叔叔你的视频非常好，每天看你视频都是开心， 得知你这个消息心里很难受！王叔一路走好 
2022.01.12, メOnly◇廻鳦, 0, 终于走了不应该是最终吗？ 
2022.01.12, 最咸的那条, 0,  
2022.01.09, 静静♡, 0, 如果是我 我也会继续坚持治疗 
2022.01.01, 心心念念~, 0, 假如有一天我想让自己走的那句都说不出来咋办 
2021.12.30, Kevin, 0, 老王 村花在等你 
2021.12.29, 傻缺很多，变态能火, 0, 好走～王爷爷 
2021.12.29, 天天蜜米, 6, 这个就是跟六爷，村花，拍段子那个老王，刚刚看了好多评论就是这个王爷爷， 
2021.12.29, 张先生, 0, 当初我爷爷就是要插管，我一个孙子看着我爷爷真的觉得他好难过，最后还是走了 
2021.12.28, jysm6688, 0, 我外婆走之前也是这样，满身插满管子。想想好想哭 
2021.12.27, 随风公子, 4, 这是六爷那个老王吗 
2021.12.24, 歇哈, 0, @@倩_ 
2021.12.23, 丁伟, 0, 56岁孙子都结婚了？ 
2021.12.23, 我不是不想我也想, 4, 这个是课余时间的老王吗 
2021.12.20, 小许在界何, 1, 死不是一个人的事，不是一家人的事！ 
2021.12.14, BetterChloe, 0, 慢性支气管炎这么严重的吗？？？ 
2021.12.14, 成曦, 0, 有一天我老了，请让我没有痛苦的走吧，总比让我痛苦的活下去，更有意义的多 
2021.12.13, 小明, 0, 有钱难，没钱更难，害怕 
2021.12.13, 荷花, 0, 我53岁，我跟我老公说了，但凡我有了急病，比方说脑梗死，心梗呀啥的，自己说了不算的时候就不要抢救了，让我痛快点，别让我遭罪，我怕疼 
2021.12.12, 花花花, 0, @酱板鸭Maruki 感触好深 
2021.12.12, 小白兔, 0, @细雨如歌：如果是这样，儿女们都不应该这么自私，让病人少受一点痛苦快点解脱吧！这才是真正的孝敬 
2021.12.12, 我还记得……, 0, 也要珍惜生命的最后一次真严！ 
2021.12.12, jun, 1, 为什么折磨他 
2021.12.08, 水果岚, 1, 我爸爸也气切了真的很痛苦后悔 
2021.12.07, orange, 0, 看着让人感到心疼无奈，想到多年后的自己，眼泪情不自禁的流了下来，命运有时候真的没办法掌握在自己的手之上 
2021.12.07, 糖糖妈^O^Keroo炫点合伙人, 0, 我经历过爷爷奶奶的离去，但是我还是希望他们多留一下这个世界，一旦放手，他们就真的不在了，我也觉得自己自私，但是真的真的不舍得，真的不舍得 
2021.12.07, 愿安, 1, ta只是跳出了时间，变成宇宙里最原始的组成部分，分子原子，慢慢的重新构建成你身边的其他事物。以后为你遮风挡雨的大树是她，为你抵挡寒冷的毛衣是她，亲人的身份消失了，其实她无处不在 。她离开了却散落四周 
2021.12.07, cuckooyoyo, 0, 道理都懂，可作为亲人怎么舍得放弃啊 
2021.12.07, 大华杨胖, 0, 选择恐惧症 
2021.12.06, 坨坨君_, 0, 奶奶在10.19号离开了我们。送到了医院，本打算不做胃管，但医生说不插胃管没法吃东西。两天后奶奶走了，我看着她鼻子里的管子，眼泪不住流了下来，我跟我妈说，早知道这么早就走了，不应该让她再受这份罪了.. 
2021.12.11, 细雨如歌, 0, 如果是这样，儿女们都不应该这么自私，让病人少受一点痛苦快点解脱吧！这才是真正的孝敬 
2021.12.06, 阔阔兔, 0, 哎，怎么说呢，医生，家属，患者，都受了折磨………可是真的要拔管，又谈何容易…… 
2021.12.06, 清清1005., 0,  
2021.12.05, 白桦6018, 2, 这样的片子在电视台很难看到，很真实，触碰人心。 
2021.12.05, 李木木夕, 0, 很能理解哎 
2021.12.05, 天岚, 0, 我们这里管去世的老人叫喜丧，意思就很明显。 
2021.12.03, 大V, 0, 讲得特别好 
2021.12.03, 7877改名字了, 0, 生如夏花之绚烂，死如秋叶之静美。热爱生命，尊重生命。 
2021.12.02, Tao濤, 0, 太受罪了 
2021.12.02, 小雨、, 0, 我妈因车祸头伤的很重，我们全家奋力挽留，留下了我妈生命，气管插管胃管，尿管带了快三年，植物人。不会说话，不会走路，我们就这样默默地照顾她，有时候想想假如她会说话，会表达，她肯定不愿意这样不体面的活着。 
2021.12.02, 流年, 1, 人到这一步时，最为难做选择的就是家人！真的是矛盾！心都碎了 
2021.12.01, 狼图腾, 0, 我父亲走的时候，我们兄妹三人都不准备抢救了，父亲肺癌晚期，没有告诉过老父亲，老父亲坚持了三年半，最后全身转移了，我们觉得让父亲有尊严的走， 
2021.12.01, zyl, 0, 唉 
2021.12.01, 公主, 0, 残忍的孝顺 
2021.11.30, 行者, 0, 我当年放弃给老爸插管，时常内疚，没有床前尽孝，没有尽力 
2021.11.29, 唐焕烨, 0, 很现实，我爷爷走的时候没给他插管，让他走了。 
2021.11.29, 昊铭企划, 0, 勉强延续的身后太多的故事 
2021.11.29, 谁是谁的谁？, 0, 多么残忍的"孝顺" 
2021.11.29, Catherine chang, 0, 殘忍的孝 
2021.11.29, 莫棉, 0, 某一天乳腺癌的我也会离开，我也选择静静的离去不要挽留 
2021.11.29, 一一二, 0, 是让病人痛苦，还是让自己痛苦，如果是我我选择自己去承受也不想家人在最后还承受那样的折麽 
2021.11.29, 岩涩, 1, 子女在这个时候的无奈只有经历过的人才会体会到，救与不救都是痛苦的选择。救了，看到老人没有尊严、没有质量的活着，对子女也是一种折磨，直到老人走了！不救，抉择的时候痛不欲生，且这种痛会一直折磨着子女！ 
2021.11.28, 容颜易老……, 0, 看到这个视频心中释怀了当初为爸爸做的决定是正确的。没让他受这种痛 
2021.11.28, 哆啦莱莱, 0, 其实我们作为儿女家人 舍不得是很正常的 只要他还有活的希望都不愿意放弃 放弃好像是一件很残忍的事 但是有没有想过作为躺在床上的那个人活着有多痛苦 让他安安静静的走吧 这才是最好的解脱 
2021.11.26, 玉润梅香, 1, 我妈妈曾经在健康状态下留下过话 万一她出现重症不清醒时 不允许我们送医院抢救 我们一家人才能听从医生的话 做出放弃有创抢救的决定 让妈妈按照她的意愿离开了人世 
2021.11.22, 娜。。娜爱吃辣, 0, 我爸也是这病，67岁，老王经历的，我爸经历过两次，今年住院半年才出院，目前状态还好，气管切开，留了金属管，不能说话了，每天在家吸氧，看电视，但我明白，不知道哪一次，就回不来了，我不舍！在的时候多陪他！ 
2021.11.10, 蚝油捞面乐悠悠, 0, 父母在，家就在！我爸也在医院 
2021.11.06, 王小明同学, 0, 子女不是舍不得挽留，而是孙子马上要结婚，不想丧事影响婚事 
2021.11.05, 小玲玲, 0, 我爸爸肺癌晚期，第一次化疗的第三天爸爸突然恶化，医生让我们决定要不要插管，我问人是清醒的吗，医生说是清醒的，我们真的舍不得让爸爸清醒的插管躺在陌生的地方，医生说不要进去了，没有必要了，安静走吧 
2021.11.01, 林儿响叮当, 1, 如果真的留不住，就要学会放手！ 
2021.10.31, Xiahzart, 3, 爷爷因为肺病最后离开，我一直因为最后妥协了没有送爷爷去医院内疚了这么多年，今天看完了视频释怀了，纵使当时有太多的舍不得但是最后让他体面的离开是最好的安排吧 
2021.10.24, 荼靡, 0, @仙女味ii 在ICU见过无数个这样的病人 
2021.11.22, 峰, 1, 我爸13号也是重症监护室昏迷送回了家，第二天早上的二点四十八分永远离开了我 
2021.10.22, 不要哭 不要哭, 1, 说出“但我老了，可千万不要这样”的时候，儿子也承认了这是痛苦的折磨！却依然执拗的折磨着自己的爸爸！ 
2021.10.21, 辰星房产中介, 0, 我爸爸也是这种病，希望以后不会这么痛苦 
2021.10.21, 捡破烂的哥斯拉, 1, 看了心很痛……无论是坚持还是放弃，都是一辈子无法逃避的痛，失去至亲也等于失去自己的半条命，今后是无穷无尽的思念…… 
2021.10.21, 面筋辣条是两只猫, 1, 我的姥姥走的时候，我妈说了一句，妈没了，这个家就真的没了 
2021.10.21, 粒♛籽, 1, 自己都不愿意忍受的痛苦，却让自己的至亲痛苦走向死亡 
2021.10.21, Kitty, 1, 经历过，真的好难，好心痛 
2021.10.21, 快乐小蜜蜂, 0, 看着真让人揪心作为学过社工的，根本没有勇气去接触医疗社工方面，太伤感了 
2021.10.21, 晨晨, 2, 老人到了这个时候，就让他走，不要增加他的痛苦，我的父亲在生命的尽头，我直接说，我不怕别人怎么说，我只想让他解脱，我希望我将来不要受这种苦，给自己，也给家人一个解脱 
2021.10.21, 一颗鲜美多汁的, 0, 都经历过 
2021.10.21, 一颗鲜美多汁的, 0,  
2021.10.20, , 0, @会开花＊ @M 全部看完了 
2021.10.20,  糖宝, 0, @嗯我姓乔 @世态炎凉 太可怕了 
2021.10.20, 猫精, 0, 如果未来我面临如此情况，我希望我的子女子孙，让我有的舒服一些.. 
2021.10.20, 杜欣, 0, 唉 
2021.10.20, 毛哥, 0, 这是个什么纪录片 
2021.10.20, 大白, 1, 刚刚经历了，我们没有选择给爷爷插管，最后不想让他再遭罪了。爷爷，我爱您！ 
2021.10.20, ګۊももこ', 0, 妈妈走之前签了放弃抢救，没有阻拦她。 
2021.10.20, 超超级空白格, 0, 我看过《最后最后的告别》文章提出了一个概念，叫做“善终护理”。他不是无所作为，而是在最后的期限前，以医生的专业判断，为病人的意愿做出最合适的优先顺序。家长型医生存在有必然性 
2021.10.20, 至秦至秦, 0, @咕叽 我看哭了 
2021.10.20, 平凡, 1, 好想我的奶奶，临终前半个月没有说过一句话 
2021.10.20, xiao 周, 0, 家人很舍不得离去，可对于病人自己来说那是痛苦不已的挣扎 
2021.10.20, 娜可不一样, 1, 这算愚孝吗 
2021.10.20, 有窝的牛（横竖口）, 1, 很高级的视频 
2021.10.20, 啊莎童品, 0, 爷爷在我婚礼前20天去世的 
2021.10.20, fatb, 0, 真的受罪 哎 
2021.10.20, 7107107, 1, 我总觉得家人是真的舍不得老人离去，可以说是孩子自私，但是是真的舍不得自己的父母离开 
2021.10.20, xy在心里呢, 0, @@是xy 
2021.10.20, 月下光, 0, 唉:-( 
2021.10.20, ○乎 吸 、, 0, 俗话讲，好死不如赖活着。我们作为子女的有几个放弃那份亲情去告诉大夫停止治疗。他有一口气这个世界上还有爸爸，没有这一口气就什么都没有了 
2021.10.20, ﹌~, 6, 两年前 我也面临过这样艰难的抉择 病人是我的哥哥 如果选择气切 他还能再活十年 可是我没有 我不想让他没有尊严的活着 我依然记得我是怎么跪在爸妈面前求他们别让我哥遭罪了 
2021.10.20, 指尖的信仰, 0, 6 
2021.10.16, yaoyao, 0, 选择有尊严的离去，是我最后的倔强 
2021.10.16, 青鹤, 1, 看着听着……心都抽在一起，如果是我不要选择这样的活着，因为痛和无奈 
2021.10.16, 繁花, 0, 他的儿子们，够狠 
2021.10.16, 文, 2, 不放弃病人痛苦，放弃家人愧疚后悔，两难的选择 
2021.10.15, 小黑哥, 0, 我妈妈 就是这种状态 我让她走了 但现在想想还是很难受 不知道这么做 对还是不对 
2021.10.15, 我们在一起, 0, 文案很棒 
2021.10.15, winniecat, 1, 我爸走的急，虽然不痛苦，但活着的人却很痛苦，我无数次想，要是爸爸活着，哪怕苟且，我也愿意！我会付出一切代价让他活着！ 
2021.10.15, HEp—2, 0, 活着的时候就把尊严踩在了脚底下努力的撑着一家人的生活，等到要死了却连死的尊严都没有，这就是求死不得，求生更办不到！ 
2021.10.15, 杨哈哈, 2, 选择太残忍，怎么选好像都不对 
2021.10.15, 静霄, 0, 我老妈跟我说，如果有一天动不了了，不要让她受罪，该有就走了。 
2021.10.14, 淡然一笑, 2, 不能接受，那怕别人说我不孝，也不能让老人遭这样的罪 
2021.10.13, 蓉蓉蓉蓉不吃香菜, 2, 我宁愿我爷爷能这样活着 起码比我见不到他好 我爷爷走的太快太快 我的想念太久了 
2021.10.12, zoey小鱼儿, 0, 看您的视频眼泪没止住一直流 
2021.10.12, 芳664992, 3, 让老人没有痛苦有尊严的离去也是孝顺 
2021.10.12, 遇见•田, 1, 很多时候抉择太难了，维持老人痛苦，不维持就是永别 
2021.10.11, 橘橘, 1, 我奶奶在医院住了2年多，今年走了，看着她都好痛苦，但一句话说的对，很多事情不是一家人说了算 
2021.10.14, 用户6399757027169, 0, 每个人每个家的决定都会有人支持也会有人反对，这种，两方面想都有道理吧，怎么做都会被骂，也都躲不过良心。太难了 
2021.10.11, 慰茹凉, 2, 我的爸爸跟这位爷爷一样的病，我们没有那么自私的挽留爷爷。虽然那种失去亲人的痛是刻骨的，可是，我还是庆幸没有让我亲爱的爸爸没有遭这样的罪，您长眠，我长念，我爱您爸爸 
2021.10.11, 尹惠子, 2, 如果我活着清醒的时候，自己签好放弃过度治疗和抢救的同意书，能行不？ 
2021.10.11, 草酸艾斯-, 0, 看个片头就忍不住哭 
2021.10.11, Rea, 0, 但是我做不到看着老人走了什么都不做 
2021.10.09, 成都京城御方堂, 4, 这个时候 尊重一下老人的意见吧，真的是难以忍受的痛苦啊 
2021.10.08, 安康, 0, 这个视频看哭了我，真的为这个老人痛苦，赞成医生的观点 
2021.10.08, 荆棘木头, 1, 感谢这个视频带给更多的人觉醒！人总要面对生老病死！谁也逃不过！可是我们在尊重生命的同时也请尊重它的痛苦 
2021.10.08, 慢时光, 0, 没有生活质量，消耗孩子，让我平静没痛苦的走 
2021.10.07, 凡人茶事 仙女下凡的凡 文汇路最美茶艺师, 1, 我奶奶也是，年轻时结扎留下的后遗症，现在七十多了，一年住院好几次，几年前医生建议切管，后来没切，家庭呼吸机，每天吸氧7-8小时，现在生活都能自理 
2021.10.07, 星空暖阳, 2, 我不能接受没有尊严的活着，太难过了 
2021.10.06, 萝卜坨坨, 1, 想起了我奶奶，当年也是在没有回转余地的情况下，我劝老爸和叔叔他们不要做没有意义的抢救，那种抢救只会让奶奶的全身插着各种管子。从当初劝说直到此时此刻，我都不知道是自己冷血还是冷静 
2021.10.06, 可乐炸鸡, 0, 真的不知道是孝顺还是不孝 
2021.10.05, 小11, 0, 好心酸 
2021.10.05, 浅奏離歌, 3, 让老人有“尊严”的离开是最好的孝心！ 
2021.10.05, 我叫元元姐, 1, 如果我有那么一天，希望我能体面的离开 
2021.10.05, 清欢, 1, 生与死都是如此的身不由己 
2021.10.04, 用户3041881789423, 1, 没有质量的活着，对病者是一种折磨，对生者也是一种折磨，愿大家都能理解作者的苦心！ 
2021.10.04, 橙子, 1, 爸爸的抢救也是那么痛苦，在ICU15天就走了，如果最后不折腾可能他会少受罪 
2021.10.04, 十一月, 1, 看得热泪盈眶！生命的最后如果这样没有尊严，没有质量的活着，该是多么痛苦的事情，“让我走”大概是每一个这样病人的心声吧！ 
2021.10.04, user4843248516128, 0, 这样活着痛苦他的儿女何常不知道，可是有些事情那有狠的下心放弃呢，不是在乎外人怎么说，他是他们的父亲怎么舍得放开呢，我很理解他们的心情 
2021.10.04, 孤城画角, 1, 太感同身受了，我爸爸就是这样，我知道切开气管只是让他活着，维持不了太久，但是我真的没有办法，在他还有呼吸的时候，拔掉氧气管～ 
2021.10.03, 雪域晨曦, 2, 真的很难很难，想想人真的没意思。 
2021.10.03, 梓涵宝贝, 0, 视频太好了 
2021.10.01, 晴天~, 0, 在icu实习过，很压抑，也有一个爷爷六十多岁家里有条件家人什么医疗都给上，但很痛苦，在icu一天天脸色更差 
2021.10.01, 晴天~, 0, 临终关怀 
2021.09.29, 愤怒的兔子, 0, 平台就应该多点这种好视频，满满的正能量 
2021.09.29, 咖啡是美式, 2, 试想一下，如果我的爸爸或者妈妈，我也舍不得他们走，不插管，我就没有爸爸妈妈了，我害怕，恐惧，我也知道这是不对的，但我舍不得，自私的决定很容易但另一个决定却是那么的艰难 
2021.09.29, WHWH, 0, 背景音乐是什么名字很好听 
2021.09.28, 时光滥好人, 1, 这个真的看不下去，每一个故事都会哭，颤抖的哭，是不是看的了这个，就能敢面对生死 
2021.09.28, 用户770227, 0, 这样的儿女为了自己的面子，让老父亲受这样的罪，太自私啦！ 
2021.09.28, 汤 小 包, 0, 鼻子酸 
2021.09.28, 大苏菲菲, 1, 生命只是时间的过客，哭闹着来，应笑着走。顺应天道好轮回，死亡是生的新开始 
2021.09.28, 游姐姐, 2, 作为儿女确实很难选择让父母走，看完这个视频，如果我自己这样，我希望爱我的人能让我走 
2021.09.27, 常回家看看, 0, 我老爸也是但作为儿子，我不能放弃，无奈啊！ 
2021.09.27, 用户190783, 0,  
2021.09.26, Emma liu, 1, 生不能择时，死也一样，人老了，命在孩子手里！ 
2021.09.26, 子意于心, 0, 一样的感受，但是就想让她多陪我们，可能太自私了，她受了好大罪，走了也解脱了 
2021.09.25, Coffee, 0, 我妈妈刚刚走，庆幸没让我妈受这样的折磨。妈，想你 
2021.09.24, 幸福从来不会缺席, 0, 生命好脆弱 
2021.09.23, 无, 1, 无论是选择放弃还是治疗，对于子女来说都是艰难的选择，而背负的更多，可是目的不就是为了多让父亲陪陪我们 
2021.09.23, 无, 1, 放弃是很难的一个决定，做儿女的怎么会选择放弃呢？那个决定太艰难了，作为子女，谁不想父母可以安享晚年呢？可是，不管怎么样，只要心脏还在跳动，就有爸爸，因为一旦分别要很久很久很久，能多看一眼就多看一眼 
2021.09.23, 尧尧, 0, 我妈和我不止一次的说过，如果她有这样的一天，让我不要救她，她说她不想痛苦。让我将来能尊重她的意见！ 
2021.09.23, 丁绍祥小宝贝, 0, 都好好的 
2021.09.22, 风筝, 0, 我将来老了，还在清醒的时候我一定要留下话如果生命已经无法挽救不要挽救不要插管 
2021.09.25, 女人如烟, 0, 我爸爸去年也这样，一样一样的接受这些治疗，每天都会含糊其辞的说，用颤抖的手这下，我想回家，你们把我送回家，可是，在我们近乎无知的固执下，治疗了三个月后，在我爸爸奄奄一息的情况下，上午回家下午就走了！ 
2021.09.22, , 0, @自然醒oo  
2021.09.22, 琳琳波光, 2, 老慢支真的很痛苦。我爷爷奶奶都是这个病走的 
2021.09.22, Niko酱, 24, 儿子的做法完全可以理解，但是他们经历不了他父亲的绝望。 
2021.09.21, (๑• . •๑), 0, @Scar. 看哭了 
2021.09.21, 双姐, 0, 我们前几个月也是刚刚这样的事情，作为家属真的很难决定…当医生问下一次要不要再抢救时，你真不知道怎么回答好，90多岁的奶奶没有作第二次抢救就走了… 
2021.09.21, 君言小姐姐, 0, 我想我爷爷了 
2021.09.21, 悠然入梦, 0, 好视频 
2021.09.21, ᥫᩣ෴₅₂₀¹³¹⁴, 3, 这么活着太痛苦了，哎 
2021.09.20, 小辛, 2, 太残忍了 
2021.09.20, A遗忘, 0, 我在想我舅舅也是慢阻肺，以后会不会也是这样，多难受 
2021.09.20, 橙子和玉米, 2, 我的爷爷也生病了，不知道还要熬到什么时候 
2021.09.19, 我很高贵, 2, 感谢你能用这种方式合理公平叙述现在生活的无奈和痛苦。感谢 
2021.09.19, 疯爷的涅槃, 0, 尊严的走，苟且的活，如何选择 
2021.09.19, 赖毛, 2, 视频拍的真的特别好 
2021.09.19, 告诉自己一个坚强的理由, 1, 人的生命，到最后自己不能选择，作为儿女，尽力的挽留父亲的生命，作为父亲，这样活着很痛苦，哎，，， 
2021.09.19, ♬娴, 1, 我老妈92岁走的，我很庆幸没让她插管，挽留是我们子女的自私。您长安，我长念 
2021.09.19, 西瓜, 3, 我父亲2018年肺癌，2021.7.31无痛苦走了，爸爸是清醒的走的，最后的时间都在家里，我跟妈妈每日都在家陪着他，最后走的很快，没有什么痛苦，现在已经走了50多天了，每日我都在想他 
2021.09.19, 天地玄黄, 0, 唉！ 
2021.09.19, yuqian2020, 2, 大家都说他好福气，可是谁又知道他最后一段时间有多痛苦。没有亲身经历是体会不到的 
2021.09.19, 麋鹿不迷路-, 1, 所以我没有办婚礼，领了证没多久我奶奶就走了，当然是我们家属签了放弃治疗。因为她很痛苦很痛苦。后面她解脱了。 
2021.09.19, 人间清醒, 0, 什么病 
2021.09.19, 烟花, 1, ICU的日子很难过，不知道白天还是黑夜，只能静静的躺在床上，听着机器的声音（滴滴滴…）；喉管插管后的生活像一个机器人一样，换了普通病房，每天都需要挂针来补充营养，每次换金属气管的时候像用刀割肉一样痛 
2021.09.19, LW LW LW, 0, 无奈啊，自己不能决定自己的生死 
2021.09.19, 风清云淡, 2, 我爸爸就是全身插满管子，在ICU离开我了，我虽然一直没有放弃治疗，但是他还是不愿意在人间受罪离开我，也许我真的不能明白他的受痛苦，愿爸爸在天堂一切安好，爸爸我想您了 
